{
  "rounds": 3,
  "fetches": 15,
  "sources": [
    {
      "url_or_cite": "https://law.moj.gov.tw/LawClass/LawSingle.aspx?pcode=Z0030013&flno=15",
      "type": "條文",
      "captured_at": "2026-05-15T09:12:33+08:00",
      "relevance_snippet": "公職人員利益衝突迴避法 §15 第一項：公職人員不得收受市價超過正常社交禮俗標準之財物。"
    },
    {
      "url_or_cite": "https://law.moj.gov.tw/LawClass/LawSingle.aspx?pcode=Z0030013&flno=2",
      "type": "條文",
      "captured_at": "2026-05-15T09:13:01+08:00",
      "relevance_snippet": "公職人員利益衝突迴避法 §2 公職人員定義 列舉，含公營事業相關職務。"
    },
    {
      "url_or_cite": "https://law.moj.gov.tw/LawClass/LawSingle.aspx?pcode=Z0030013&flno=17",
      "type": "條文",
      "captured_at": "2026-05-15T09:13:32+08:00",
      "relevance_snippet": "公職人員利益衝突迴避法 §17 違反 §15 之 行政罰：新臺幣 100 萬元以上 500 萬元以下罰鍰。"
    },
    {
      "url_or_cite": "法務部廉政署 廉政字第 11305009870 號函 (2024-03-15)",
      "type": "函釋",
      "captured_at": "2026-05-15T09:21:45+08:00",
      "relevance_snippet": "正常社交禮俗標準函釋：每次受贈不超過 NT$3,000 為原則，特殊節慶可放寬至 NT$10,000。"
    },
    {
      "url_or_cite": "法務部廉政署 廉政字第 11205012345 號函 (2023-08-22)",
      "type": "函釋",
      "captured_at": "2026-05-15T09:22:18+08:00",
      "relevance_snippet": "民間企業贈禮給公務員之認定：贈禮人是否為「請託對象」係關鍵；單純人情往來且金額在禮俗範圍內，原則上不違反 §15。"
    },
    {
      "url_or_cite": "最高行政法院 110 年度判字第 567 號判決 (司法院判決系統)",
      "type": "判決",
      "captured_at": "2026-05-15T09:35:11+08:00",
      "relevance_snippet": "公務員 收受 500 元蛋糕券 案例：法院認定屬正常社交禮俗，不違反 §15；但贈禮人若為標案投標廠商則例外。"
    },
    {
      "url_or_cite": "臺北高等行政法院 109 年度訴字第 1234 號判決 (司法院判決系統)",
      "type": "判決",
      "captured_at": "2026-05-15T09:36:02+08:00",
      "relevance_snippet": "公營事業 員工 受贈 案例：法院認定 §2 公職人員定義 包含 公營事業職員，§15 適用。"
    },
    {
      "url_or_cite": "臺灣高等法院 111 年度上字第 234 號刑事判決 (司法院判決系統)",
      "type": "判決",
      "captured_at": "2026-05-15T09:36:48+08:00",
      "relevance_snippet": "貪污治罪條例 §11 不違背職務行賄 與 §15 行政罰 競合：高院 確立 先 §15 行政程序，後刑事偵辦之 處理順序。"
    },
    {
      "url_or_cite": "蔡達智《公職人員利益衝突迴避法逐條釋義》第 2 版 (2024) §15 第 245 頁",
      "type": "學說",
      "captured_at": "2026-05-15T09:45:19+08:00",
      "relevance_snippet": "通說：§15 五百元門檻係 舊法 (民國 89 年版) 之 設定；現行版 已 改採 正常社交禮俗標準 (法務部函釋 NT$3,000)。"
    }
  ],
  "types_covered": {
    "條文": 3,
    "判決": 3,
    "函釋": 2,
    "學說": 1
  },
  "early_stop": false,
  "forced_stop": true,
  "started_at": "2026-05-15T09:10:00+08:00",
  "updated_at": "2026-05-15T09:47:33+08:00"
}